<?xml version="1.0" encoding="UTF-8"?>

<!--
~ JBoss, Home of Professional Open Source.
~ Copyright 2013, Red Hat, Inc., and individual contributors
~ as indicated by the @author tags. See the copyright.txt file in the
~ distribution for a full listing of individual contributors.
~
~ This is free software; you can redistribute it and/or modify it
~ under the terms of the GNU Lesser General Public License as
~ published by the Free Software Foundation; either version 2.1 of
~ the License, or (at your option) any later version.
~
~ This software is distributed in the hope that it will be useful,
~ but WITHOUT ANY WARRANTY; without even the implied warranty of
~ MERCHANTABILITY or FITNESS FOR A PARTICULAR PURPOSE. See the GNU
~ Lesser General Public License for more details.
~
~ You should have received a copy of the GNU Lesser General Public
~ License along with this software; if not, write to the Free
~ Software Foundation, Inc., 51 Franklin St, Fifth Floor, Boston, MA
~ 02110-1301 USA, or see the FSF site: http://www.fsf.org.
-->

<job id="job1" xmlns="http://xmlns.jcp.org/xml/ns/javaee"
     xmlns:xsi="http://www.w3.org/2001/XMLSchema-instance"
     xsi:schemaLocation="http://xmlns.jcp.org/xml/ns/javaee http://java.net/projects/jbatch/sources/jsr-352-git-repository/content/JSR352.JobXML.Model/src/main/resources/jobXML.xsd">

    <properties>
        <property name="job-prop" value="job-prop"></property>
        <property name="job-prop-2" value="job-prop-2"></property>
    </properties>
    <listeners>
        <listener ref="L1">
            <properties>
                <property name="listener-prop" value="listener-prop"></property>
                <property name="reference-job-prop" value="#{jobProperties['job-prop']}"></property>
                <property name="reference-job-param" value="#{jobParameters['job-param']}"></property>
                <property name="reference-system-property" value="#{systemProperties['java.version']}"></property>
            </properties>
        </listener>
        <listener ref="L2"></listener>
    </listeners>


    <flow id="flow1" next="step4">
        <step id="step1" next="step2">
            <properties>
                <property name="step-prop" value="step-prop"></property>
                <!-- same property name as in job, to test property resolution precedence -->
                <property name="job-prop-2" value="step-prop-2"></property>
            </properties>
            <batchlet ref="Batchlet1">
            </batchlet>
        </step>

        <step id="step3">
            <batchlet ref="Batchlet1">
            </batchlet>
            <end on="*" exit-status="done"></end>
        </step>

        <step id="step2">
            <batchlet ref="Batchlet1">
            </batchlet>
            <stop on="xyzz" exit-status="stopped" restart="false"/>
            <!-- should not reach here -->
            <fail on="abcd" exit-status="failed"/>
            <!-- should not reach here -->
            <end on="12345" exit-status="done"/>
            <!-- should not reach here -->
            <next on="aaa" to="step1"/>
            <!-- should not reach here -->
            <next on="*" to="decision1"></next>
        </step>

        <decision id="decision1" ref="Decider1">
            <properties>
                <property name="decision-prop" value="decision-prop"></property>
                <property name="reference-job-prop" value="#{jobProperties['job-prop']}"></property>
                <property name="reference-step-prop" value="#{jobProperties['step-prop']}"></property>
                <property name="reference-system-prop" value="#{systemProperties['java.version']}"></property>
                <property name="reference-job-param" value="#{jobParameters['job-param']}"></property>
            </properties>
            <next on="aaa" to="step1"></next>
            <!-- should not reach here -->
            <next on="next" to="step3"></next>
            <!-- "next" is the value returned from Decider1.decide() -->
            <end on="*" exit-status="done"></end>
        </decision>
    </flow>

    <step id="step4">
        <batchlet ref="Batchlet1">
            <properties>
                <property name="batchlet-prop" value="batchlet-prop"></property>
                <property name="reference-job-prop" value="#{jobProperties['job-prop']}"></property>
                <property name="reference-system-prop" value="#{systemProperties['java.version']}"></property>
                <property name="reference-job-param" value="#{jobParameters['job-param']}"></property>
            </properties>
        </batchlet>
    </step>

</job>
